{
  "topology_id": "H-e6-t17-local-independent-verify",
  "task_id": "e6-t17",
  "unresolved_distinctions": [
    "Q1",
    "Q2",
    "Q3"
  ],
  "principles_invoked": [
    "P-ATTENUATION",
    "P-AUTHORITY-SEPARATION",
    "P-FRESHNESS",
    "P-INDEPENDENCE",
    "P-LOCALITY",
    "P-MINIMALITY",
    "P-PROPOSAL-OBSERVABILITY",
    "P-STATE-MEDIATED-CONTINUITY",
    "P-VERIFY"
  ],
  "harness_spec_ref": "sha256:2d297144e27fe2d194fa8ed32759d6171e505a0a9b64d2739b64c2f08cba6af2",
  "harness_spec": {
    "task_id": "e6-t17",
    "goal": "Local resolution of e6-t17 with an additional independent verification pass",
    "max_depth": 0,
    "max_model_calls": 2,
    "nodes": [
      {
        "id": "observe-evidence",
        "primitive": "observe",
        "tools": [
          "Read"
        ],
        "can_create": false,
        "instructions": "Acquire all governed evidence for the task."
      },
      {
        "id": "resolve-local",
        "primitive": "hypothesize",
        "tools": [
          "Read",
          "Write"
        ],
        "can_create": false,
        "instructions": "Resolve every unresolved distinction from local evidence; persist the resolution."
      },
      {
        "id": "verify-resolution",
        "primitive": "verify",
        "tools": [
          "Read"
        ],
        "can_create": false,
        "instructions": "Deterministically verify the resolution against the task deliverable."
      },
      {
        "id": "verify-independent",
        "primitive": "verify",
        "tools": [
          "Read"
        ],
        "can_create": false,
        "instructions": "Independent information-only examiner re-verifies the resolution; no write, no promotion authority."
      },
      {
        "id": "return-result",
        "primitive": "return",
        "tools": [
          "Read",
          "Write"
        ],
        "can_create": false,
        "instructions": "Return the verified result into the governed boundary."
      }
    ],
    "edges": [
      {
        "source": "observe-evidence",
        "target": "resolve-local",
        "relation": "observe",
        "requires_response": false,
        "response_changes_parent_state": false,
        "transfers_authority": false
      },
      {
        "source": "resolve-local",
        "target": "verify-resolution",
        "relation": "verify",
        "requires_response": true,
        "response_changes_parent_state": false,
        "transfers_authority": false
      },
      {
        "source": "verify-resolution",
        "target": "verify-independent",
        "relation": "verify",
        "requires_response": true,
        "response_changes_parent_state": false,
        "transfers_authority": false
      },
      {
        "source": "verify-independent",
        "target": "return-result",
        "relation": "authorize",
        "requires_response": false,
        "response_changes_parent_state": false,
        "transfers_authority": false
      }
    ]
  },
  "resolution_map": {
    "Q1": "resolve-local",
    "Q2": "resolve-local",
    "Q3": "resolve-local"
  },
  "predictions": [
    {
      "prediction_id": "H-e6-t17-local-independent-verify-pr01",
      "topology_id": "H-e6-t17-local-independent-verify",
      "claim": "distinction Q1 (What is the complete set of distinct parses (fully parenthesized, no-space forms) is resolved by node resolve-local",
      "observable": "post-execution resolved/unresolved distinction record and evidence provenance",
      "success_condition": "Q1 appears in resolved_distinctions with resolving evidence attributed to resolve-local",
      "falsification_condition": "Q1 appears in unresolved_distinctions after execution, or its evidence is not attributable to resolve-local",
      "weight": 1.0,
      "kind": "resolves",
      "subject": {
        "distinction_id": "Q1",
        "node": "resolve-local"
      },
      "principles": [
        "P-LOCALITY"
      ]
    },
    {
      "prediction_id": "H-e6-t17-local-independent-verify-pr02",
      "topology_id": "H-e6-t17-local-independent-verify",
      "claim": "distinction Q2 (Does a second, causally independent enumeration of the same parse space \u2014 produc) is resolved by node resolve-local",
      "observable": "post-execution resolved/unresolved distinction record and evidence provenance",
      "success_condition": "Q2 appears in resolved_distinctions with resolving evidence attributed to resolve-local",
      "falsification_condition": "Q2 appears in unresolved_distinctions after execution, or its evidence is not attributable to resolve-local",
      "weight": 1.0,
      "kind": "resolves",
      "subject": {
        "distinction_id": "Q2",
        "node": "resolve-local"
      },
      "principles": [
        "P-LOCALITY"
      ]
    },
    {
      "prediction_id": "H-e6-t17-local-independent-verify-pr03",
      "topology_id": "H-e6-t17-local-independent-verify",
      "claim": "distinction Q3 (What is the final merged answer \u2014 the union of both enumerations with any single) is resolved by node resolve-local",
      "observable": "post-execution resolved/unresolved distinction record and evidence provenance",
      "success_condition": "Q3 appears in resolved_distinctions with resolving evidence attributed to resolve-local",
      "falsification_condition": "Q3 appears in unresolved_distinctions after execution, or its evidence is not attributable to resolve-local",
      "weight": 1.0,
      "kind": "resolves",
      "subject": {
        "distinction_id": "Q3",
        "node": "resolve-local"
      },
      "principles": [
        "P-LOCALITY"
      ]
    },
    {
      "prediction_id": "H-e6-t17-local-independent-verify-pr04",
      "topology_id": "H-e6-t17-local-independent-verify",
      "claim": "runtime realizes the declared causal order",
      "observable": "execution ledger completes_node sequence",
      "success_condition": "node completion order equals a legal linearization of ['observe-evidence', 'resolve-local', 'verify-resolution', 'verify-independent', 'return-result']",
      "falsification_condition": "any completion outside the compiled LTS (REFINEMENT_VIOLATION) or a node absent from the realized branch",
      "weight": 1.0,
      "kind": "runtime_path",
      "subject": {
        "expected_order": [
          "observe-evidence",
          "resolve-local",
          "verify-resolution",
          "verify-independent",
          "return-result"
        ]
      },
      "principles": [
        "P-AUTHORITY-SEPARATION"
      ]
    },
    {
      "prediction_id": "H-e6-t17-local-independent-verify-pr05",
      "topology_id": "H-e6-t17-local-independent-verify",
      "claim": "execution uses at most 2 model calls",
      "observable": "resource_use.model_calls in the runtime record",
      "success_condition": "model_calls <= 2",
      "falsification_condition": "model_calls > 2",
      "weight": 0.5,
      "kind": "model_call_budget",
      "subject": {
        "max": 2
      },
      "principles": [
        "P-MINIMALITY"
      ]
    },
    {
      "prediction_id": "H-e6-t17-local-independent-verify-pr06",
      "topology_id": "H-e6-t17-local-independent-verify",
      "claim": "no actor exceeds its authority envelope",
      "observable": "formal check results over the execution ledger",
      "success_condition": "zero authority/refinement/attenuation failures",
      "falsification_condition": "any authority escalation, non-gate promotion, or attenuation failure",
      "weight": 1.0,
      "kind": "authority_envelope",
      "subject": {},
      "principles": [
        "P-AUTHORITY-SEPARATION"
      ]
    },
    {
      "prediction_id": "H-e6-t17-local-independent-verify-pr07",
      "topology_id": "H-e6-t17-local-independent-verify",
      "claim": "local evidence is sufficient: resolution and verification complete without any descendant",
      "observable": "verification record + child launch count",
      "success_condition": "verification completes with zero child launches",
      "falsification_condition": "verification is impossible from local evidence, or a distinction requires an isolated source",
      "weight": 1.0,
      "kind": "local_sufficiency",
      "subject": {},
      "principles": [
        "P-LOCALITY"
      ]
    }
  ],
  "falsifiers": [
    "a distinction in ['Q1', 'Q2', 'Q3'] remains unresolved after execution",
    "the runtime path violates the compiled LTS",
    "actual model calls exceed the declared budget"
  ],
  "predicted_value": {
    "delta_e": 0.4,
    "cost": 0.25,
    "redundancy": 0.5,
    "governance_risk": 0.0
  },
  "status": "VALIDATED",
  "child_contract": {},
  "predictions_hash": "sha256:66db6f64b3c51d5a0e2fef6d2a7033f783d7825cb6ebcd74f1457e3402dabad3"
}
